company_name,max_wages,min_wages,place,place2,education,treatment,requirement
2021太力校园招聘,8000.0,6000.0,中山市石岐区湖滨北路40号,中山,本科,无,岗位职责一、【太力星项目】太力星项目是太力集团面向高校应届毕业生运作的，集人才吸纳与人才培养为一体的人才品牌运作项目，分为“引星计划”“星培计划”及“耀星计划”，通过对优秀毕业生的选拔、培养，快速帮助毕业生成长，目标是让他们毕业两年内成为业务模块的负责人，毕业三年到五年内成为业务主管或经理。同时各届太力星将获得公司高层领导与HR持续关注，公司将在薪酬福利、职业晋升、培训发展等渠道对太力星做出政策倾斜，太力星项目旨在三到五年内为公司未来发展快速储备优秀人才，形成优质的人才池与内部人才竞争机制。二、【岗位需求】销售类：【销售精英、电商运营、跨境电商运营、产品策划、数据分析师、消费者研究员、外贸业务员、AI训练师、客服、文案策划、视频剪辑、摄影师】职能类：【人力资源专员、物流专员、财务会计、采购工程师】技术岗：【IT工程师、模具工程师、结构工程师、材料工程师、自动化工程师、工艺工程师、情报员、资料工程师、品质工程师、外观设计工程师】任职要求2020届全日制本科或以上学历应届生销售类：电子商务、人工智能、国际营销与贸易、市场营销、英语、日语、俄语、意大利语、西班牙语、心理学等相关专业职能类：人力资源管理、会计、财务管理、工商管理、物流管理、档案学等相关专业技术岗：计算机科学、软件、信息管理与信息系统、情报检索、工业设计、机械设计及其自动化、自动化工程、高分子材料、模具成型与控制工程等理工科专业三、【公司福利】1、竞争力薪酬体系：全面薪酬结构，包括基本工资、年终奖、绩效奖金、主管/技术津贴、特殊津贴、提成工资、年度奖金、年度调薪等。2、人性化福利关怀：免费食宿、社会保险、有薪假期、健康体检、节日生日礼物、年度旅游，年底评优及各类个性化福利关怀；3、丰富的学习平台：与高校实行校企合作，成立太力本科班，设有太力商学院，开设高端管理、先进技术与产品、新媒体时代营销等系列课程，公司董事长为特聘讲师，为太力人传道授业解惑；4、完善的职业通道：管理类与专业类职业发展双通道体系、您可以根据个人选择发展线路，具备更为广阔的发展通路与方向；5、开放的企业文化：开放包容的企业文化，善于招纳贤人志士，有得才、惜才、用才的企业环境与文化底蕴。职能类别：电商专员产品助理关键字：管培生校招生微信分享
实习生,5000.0,3000.0,高新区天府三街云华路290号峰汇中心1604,成都-高新区,本科,"餐饮补贴,通讯补贴,专业培训,绩效奖金,年终奖金,弹性工作",Hi 当您划到我们的职位信息的时候，我们希望您可以停留几分钟，以便于详细阅读该职位信息，我们相信可以帮助您在选择新的职位机会的时候，以提供更多的信息作为决策依据：）我们的团队汇集了包括清华大学北京协和医学院，北京大学医学部，中国医学科学院，第三/第四军医大学，四川大学华西医学院等知名学府博士，硕士级专业技术人才，管理团队来自于国内外知名高校并拥有上市公司管理经验，公司员工整体平均年龄28岁，是一个非常年轻化和朝气的创业团队。智塑医疗科技（easySculpt）是一家专注于为用户提供形体塑形与脂肪健康安全管理领域的专业医疗服务机构，自创业开始，在资本层面获得了来自纳斯达克上市公司-新氧（Nasdaq：SY）的天使轮投资，并获得国内专注在医疗消费健康领域专业投资机构-长岭资本A轮的领投，新氧持续跟投。与传统医疗机构相比，我们将更注重对内部人才培养与发展体系建设，以及前瞻性和开放性的内部管理体系建设，用更加标准化和专业化的方式，为用户及员工提供更卓越的用户体验为目的。以“融合专业与科技，助健康之美”是我们一直以来的使命，致力于打造行业中领先地位。我们正在开放的此职位，如果您能完成以下工作，欢迎与我们沟通：1、负责业务部门核心数据的收集和分析；2、负责销售沟通质量的检查和分析；3、协助业务团队建立销售 SOP 和知识库；4、协助数据分析师，持续优化数据工具；5、领导交办的其他事宜。我们希望您的素质模型如下：1、本科及以上学历，2022届及以后毕业的学生；2、较强的学习能力，悟性高，对数据敏感；3、熟练使用 Excel 等办公软件，了解和掌握数据分析的基础技能；注意：此岗位是实习生岗位，有人带教，能给到各种晋升机会！职能类别：实习生微信分享
软件工程师（数据库）,10000.0,8000.0,芳草街26号,成都-武侯区,本科,无,1.负责数据库的分析和设计工作；2.负责数据库业务程序开发，进行SQL代码规范审核；3.依据需求完成项目的业务数据分析；4.基于不同业务需求规划数据库设计。5.精通SQL常用语法，有较好的SQL调优经验，熟悉SqlServer、MySQL等基础数据库开发6.了解Java/Scala/Python中的一种或多种语言，了解Linux系统的常用命令7.善于表达沟通，诚实守信，责任心强，讲求效率，具有良好的团队协作精神，全日制本科毕业，计算机相关专业，有二年以上工作经验.职能类别：数据分析师微信分享
lianjia.店面销售/运营1,6000.0,4500.0,就近安排,成都-成华区,本科,"弹性工作,带薪年假,五险一金,专业培训,节日福利,绩效奖金,师傅带教,法定假日,员工旅游,全勤奖",面试地址：（总部）武侯区龙腾东路36号中海大厦12楼如有疑问可咨询总部HR 汪小秋-13568938404（电话沟通效率更高）公司薪资：1. 试用期员工：无责任底薪4500-5500（其中1000为浮动绩效，考核基础工作量）。2. 转正员工：享受保障薪资2000~6500元（职位不同保障薪资不同）+高额提成25%~82%（级别提成+业绩提成）。公司福利：1. 个人福利：弹性工作制、五险一金、带薪年假、内外部带薪培训、节日礼物，年度体检等；2. 团队活动：节日单身联谊活动、文体活动、户外拓展活动等；3. 就近分配：全成都范围可根据求职者住址及自身意愿，就近分配工作地址。工作职责：1、互联网及其他渠道收集，发布房屋、商铺、写字楼的出售及租赁信息；2、接待客户，了解客户需求，推荐匹配的信息；3、陪同客户查看，进行谈判，促成交易；4、对客户提供后期服务，维护客户关系。工作要求：1、20-35岁，统招本科学历；2、工作年限不限（实习及应届生），有工作经验者优先；3、诚实正直，喜欢与人交流，有团队精神，较强的学习能力，能吃苦耐劳。晋升空间：1、晋升通道：入职按能力享受职级，每月都有机会晋升。所有管理岗位均从内部员工提拔产生（内部竞聘）：管理层：经纪人→店经理→直销经理→区董→营业总监→分公司总经理。转职能：销售岗转内勤，如培训师、行政、人事、招聘、数据等等。2、全面房产业务知识培训(房地产法规，交易按揭流程，营销实战技巧等)，专人一对一指导，老经纪人带新人。上班时间：1、朝九晚七，中午午休；2、弹性工作制，每周单休一天可调休（每月保底休4天）；3、国家法定节假日正常休息；4、入职一年额外带薪休假5天（年假）。职能类别：销售代表数据分析师关键字：销售代表网络销售电话销售实习生应届生市场营销储备管理业务员客户代表房产顾问微信分享
银行数据分析（毕业可转正）,13000.0,8000.0,天府三街,成都-高新区,本科,无,团队负责公司核心数字化应用产品的研发。长亮科技公司员工优先，团队共担的氛围，员工归属感强。核心数据分析应用类产品研发，大型项目有较好的学习机会和成长空间。【岗位要求】1、理工科相关专业背景，应届硕士或优秀本科毕业生/实习生；2、对银行等金融业务、大数据分析，数据挖掘建模有强烈的兴趣；3、优秀的沟通能力、学习能力、抗压能力；4、对创造性的解决方案整理工作感兴趣，能快速适应项目出差的工作环境（公司提供宿舍和出差补贴）；5、了解基础的数据库相关知识，使用过常用的统计分析工具SAS/R语言/SQL/python/Matlab中的一种；6、对论文，PPT等文档撰写工作感兴趣，较好演讲能力；【岗位培养方向】1、熟悉金融和银行业务知识；2、能从数据仓库平台或其他相关数据平台数据提取对经营分析有价值的数据，构建机器学习模型或专题分析报告；3、熟悉SAS BASE/R语言/python/Matlab数据处理和数据分析；4、熟练掌握数据仓库或数据集市架构；5、熟悉数据库相关知识及SQL语言；我们不需要你已经有丰富的经验，需要你有积极乐观，虚心学习的心态，能快速融入团队，与团队共同成长。【工作地点说明】BASE地点全国可选，工作地点考虑项目需要和个人情况灵活安排。【福利待遇】六险一金：养老保险、医疗保险、失业保险、工伤保险、生育保险、商业保险、住房公积金；员工关怀：生日祝福、结婚和生子贺礼以及重大节日礼品寄送、开门利是等相关政策；其他补贴：通讯补助、电脑补助等；其他福利：健康体检、享受所有的国家法定假日、逐步增长的年休假体制、项目奖励假、探亲路程费用津贴、活动经费等。职能类别：数据分析师关键字：数据分析微信分享
数据分析师（彭州）,6000.0,4000.0,彭州市致和镇五贤路359号四川新绿色药业科技发展有限公司,成都-彭州市,大专,"五险一金,周末双休,专业培训,绩效奖金",1、收集采购数据，建立成本数据库，及时反映各成本目标执行情况；2、完成成本策划，确定成本总体控制指标；3、对成本预算、分析，控制运行系统的审核与监督工作；4、检查招标、比价、议价等采购过程，是否依据相关规定办理；5、定期检查部门各类台账、档案管理的完整性、规定性。任职要求：1、大专及以上学历，审计、会计、财务管理、工商管理等经营类相关专业；2、性格开朗，有较强的沟通能力，做事条理性强；3、执行力强，有较强的领悟能力；4、具有一定的财务知识，对数据有一定的敏锐度，具有一定的数据分析能力，能熟练运用Windows操作系统。职能类别：数据分析师关键字：数据处理数据分析师微信分享
数据分析工程师4183 (职位编号：004183),35000.0,15000.0,天府大道天府软件园C5,成都-高新区,本科,无,"岗位职责:1.  基于对业务深入全面的了解抽象业务核心逻辑，负责完成数据挖掘与应用体系顶层设计，梳理和设计数据指标体系，完善数据字典；2. 负责数据应用模型搭建，输出符合业务需求的数据分析框架和分析报告，发现经营环节中的各种问题或漏洞，提出改善和优化方案，并能够通过数据监控，督导优化方案的实施；3. 业务方向涉及HR,  财务，供应链，营销，产品研发等任职资格:1. 统计、数学、计算机相关专业本科及以上学历，5年以上数据分析相关工作经验，具有全局观、战略性思维，有半导体从业经验者优先；2. 熟练使用Excel、Sql、hive等分析工具以及查询语言，能够使用Python，R等工具进行数据分析挖掘加分；3. 有良好的数据思维和建模能力，数据敏感度较高，对数据价值有较深的认识，能通过数据建模分析发现问题，并不断推动业务的优化或赋能业务；4. 抗压性强，使命驱动，良好的沟通能力，跨部门协调能力，积极发扬团队合作精神。职能类别：数据分析师微信分享"
Clinical Data Analyst,13000.0,7000.0,来福士,成都,本科,"五险一金,补充公积金,员工旅游,专业培训,年终奖金,弹性工作,定期体检","有DM, PV, CRC, CRA或COA经验者优先。Job Description :Accountability? Provide leadership to ensure the project or program is completed within budget, schedule and according to contract specifications. Ensure the project/program is progressing according to quality standards, SOPs, ICH and/or other guidelines to fulfill regulations (including oversight and maintenance of relevant data operations project documentation).? Must manage time, and understand financials, maintain focus on quality, balancing deadlines with ensuring high quality output.? Thorough knowledge of numerous EDC systems (DataLabs, InForm, Rave.)? Thorough knowledge of electronic source data capture systems (e.g. ClinBase)? Thorough knowledge of the eClinical suite and additional tools and systems that can be integrated with a particular EDC system ( MyTrials, IVRS etc ) and Reporting functionality within the EDC system )? Thorough knowledge of all DB set- up activities including but not limited to Database Configuration Specifications, Data Validation.? Thorough knowledge of all activities during Study Maintenance and Database Lock. Review of metrics to determine risks and risk mitigation plans as required.? Effectively communicate to and manage internal project teams, external customers and third party vendors. Hold team meetings on a regular basis. Participate in client, investigator and team meetings.? Ensure interdependencies are understood, anticipate potential barriers or issues, and put plan in place with appropriate countermeasures.? Effectively manage contracted project delivery. Highlight issues/risks to delivery and mitigate risks for both PAREXEL and the client, developing contingency plans for the project (or providing input to PL). Accountable for quality control of project deliverables and timely delivery of projects.? Manage appropriate project level resourcing of staff and staff assignments. Identify and request staff necessary for the project team.? Ensure information entered into management systems is accurate and updated on a regular basis.? Review metrics reports regularly, determine the cause of any project overruns, track scope of ongoing work to identify and raise CIS in a timely manner.? Participate in cross functional meetings and drive initiatives, participate in Business Development and BID Defense meetings as required.? Prepare, participate in and follow up on audits/inspections.? Participate in meeting with Business Development / PFD / PL to understand the scope of the contract and any Master Service Agreement in place for the client? Collaboration with the Clinical team to review the ClinBase setup performed by the pharmacy, safety Laboratory team and Clinical Database Designer.Job Qualifications :English capability.CRO or Pharm experience.3-5+ years of DM experiences.职能类别：生物工程/生物制药微信分享"
数据分析,12000.0,6000.0,成都市人民南路四段三号来福士广场T2-25楼,成都-武侯区,本科,无,技能要求：数据分析岗位职责：1、理赔各类数据需求的提取和统计；2、各类需求分析；3、保险日常报表的制作和分析；4、管理数据对外报送工作，严格把控数据出口任职要求：1、全日制大学本科以上学历，数学、统计、汽车等相关专业；2、认同安盛天平企业文化，具有良好的职业道德与大局观念；3、正直、诚实，有责任心，工作主动、细致；4、具备良好的逻辑分析能力；5、具备良好的沟通协调能力；6、具有学习精神和创新精神；7、具有内部客户服务意识及团队精神。福利1.五险一金2.员工意外险3.节日福利4.午餐补助5.生日礼金6.定期体检7.带薪年假职能类别：数据分析师关键字：数据处理微信分享
数据开发工程师,3000.0,2000.0,保利中心A座910,成都-武侯区,本科,无,"1.负责项目数据资产盘点，数据标准制定、映射及落地实施；2.负责基于安全业务用数需求，梳理数据质量校验规则；3.负责日常的元数据采集管理、信息补全及标准化映射；4.负责外部数据标准4.协助完成数据目录及数据分类分级梳理；5.协助完成项目数据治理相关制度及流程制定。6、运用大数据分析方法，对模型进行没计、开发、验正、测试、部署及监控7、基于数据和特征,对数据进行价值评估8、评估数据源的质量和价值,能结合业务需求和场景,从各种数据维度中挖数据价值9、熟悉大数据分析平台及分布式计算需要对SQL、Hadoop、Spark、Azkaban熟练职能类别：数据分析师微信分享"
数据分析师,13000.0,7000.0,成都崇州市经济开发区创新路三段1号,成都,本科,"带薪年假,五险一金,包吃,包住宿,绩效奖金,全勤奖,加班补贴",具有3-5年大数据分析，机器学习及软件开发经验计算机，数学等相关专业，电子行业制造背景优先具备c#，Python，Spark，Shell，R等语言研发能力，具备Oracle，Mysql春初过程研发能力，有较好的SQL基础熟悉SAS/R/SPSS等一种分析工具优先较强的沟通和协调能力，能够同时处理多个系统项目，并适应在高度协作的环境中工作职能类别：数据分析师微信分享
高级数据分析师（双休 五险一金）,20000.0,12000.0,成都市锦江区下东大街199号睿东中心B座40楼,成都,本科,"五险一金,交通补贴,餐饮补贴,带薪年假,节假日福利","周末双休，非996自研游戏，海外市场全额五险一金，年度体检每月补贴全勤奖，定期团队建设活动不限量的饮料供应，每周两次下午茶带薪年假7天，随工作年限增加【工作时间】周一到周五 9:00-12:30 13:30-18:00岗位角色：? 分析运营与市场数据，帮助公司进行商业决策，搭建公司完备的数据系统。岗位职责：? 建设与完善数据分析体系，协助优化产品，推动业务的精细化运营；? 基于对移动应用与移动游戏业务的深入理解，制定需求，收集数据，并对数据进行统计分析、数据可视化等工作；? 不断完善数据分析体系，同时建设数据分析平台，推动业务的精细化运营和自动化分析；? 根据分析的结论，对接公司各部门，通过数据为业务策略、产品优化提供分析支持、优化建议和回归分析；? 自主检测业务的日常数据，关注数据趋势，并能够分析和解读数据异常。任职要求：? 本科及以上学历，计算机相关专业/经济学/统计/数学相关专业优先? 至少3年数据分析相关工作经验，IT或者行业经验优先? 对数据，商业逻辑敏感，擅长分析、总结，能够将数据分析与业务相结合? 熟悉SQL，Excel函数/透视表，熟悉其他数据工具如Python (Pandas, Numpy), R, MATLAB, Power BI, SPSS, SAS, Tableau等优先? 技能：业务分析，数据分析，策略分析，逻辑，时间管理等, 有埋点，市场数据采集，竞品分析，广告数据运营，推广数据运营，投放数据分析，营销活动效果分析，指标体系设计，业务运营监控, 业务数据分析，业务模式／运营策略优化,方差分析,相关分析，聚类分析,数据挖掘,机器学习算法等相关经验优先?英语可作为工作语言优先【面试流程】1、简历筛选→电话沟通→专业能力测试（远程测试）→现场专业面试（2轮）→HR谈薪→Offer Letter2、流程看似很长，但是我们效率非常高！职能类别：数据分析师关键字：行业分析商业分析SQLPython手机游戏微信分享"
数据分析师,10000.0,8000.0,青羊区顺城大街308号冠城广场21楼B,成都,大专,"五险一金,专业培训,全勤奖,绩效奖金,通讯补贴,带薪年假,交通补贴,节日福利,弹性工作","基本要求：1、熟悉或掌握C#/Java编程等一种以上编程技术，对web技术体系有一定的理解(硬性);2、熟悉或了解Javascript 、html、div+css 相关基础知识;3、有1年以上基于sqlserver/oracle Oracle数据库的系统开发经验(硬性);4、熟练的运用T-sql相关知识，对数据库的事务,锁,索引,存储过程的日常维护有一定的判断能力;5、对相关财务软件数据或报表开发有一定理解的更优;6、有较强的学习或分析理解能力，独立解决相关难题;7、心算能力和逻辑思维强的优先考虑。职能类别：数据分析师关键字：数据处理数据分析师sqlOracle微信分享"
数据分析师,7000.0,4000.0,成都烟草局,成都,本科,"五险一金,交通补贴,餐饮补贴,通讯补贴,绩效奖金,年终奖金,股票期权,弹性工作,定期体检",岗位职责：1、使用公司的可视化分析产品，处理客户的分析需求，及时分析数据并汇总反馈分析结果；2、能够面向客户对公司各类系统、产品的演示、讲解；3、记录并归纳经典的分析案例；4、利用excel、sql、python进行数据清洗、分析、建模任职要求：1、较强的语言表达能力；2、性格稳重，理智沉着，不急躁；3、本科以上学历，理工科毕业生，IT、统计学等专业毕业生佳；4、有数据分析相关经验者优先职能类别：数据分析师微信分享
数据分析师,15000.0,10000.0,创业路16号火炬大厦A座6楼,成都-高新区,本科,五险一金,"岗位职责1. 对ERP数据库进行研究和分析, 了解数据结构2. 对ERP数据进行清洗和整理,开发ETL处理程序3. 根据业务部门的需求开发自动化报表4. 对业务数据进行深入挖掘, 发现和解决问题5. 上级领导安排的其他工作事项；任职要求学历 全日制本科及以上学历    专业 数学,统计学及计算机相关专业    加分项：Python, R,数据分析等1.有一年以上数据分析开发工作经验，有ETL开发经验优先；2. 熟悉ETL开发3. 熟悉MySQL数据库，精通SQL语言;4. 精通Excel, Python, R等工具及语言""素质要求 ""1、对数据敏感，能从数据中发现问题、解决问题;2、细心，有耐性，具有较强的敬业精神和团队合作精神。3、敏锐全面的洞察力，清晰缜密的逻辑思维能力，以及独立的分析调研能力。职能类别：数据分析师微信分享"
高级数据分析师,40000.0,20000.0,武汉,武汉,本科,"五险一金,补充公积金,餐饮补贴,通讯补贴,出国机会,绩效奖金,年终奖金,弹性工作,交通补贴",1、整理本部门业务数据需求，建立业务数据模型；2、负责部门层面的业务分析工作，通过对数据的收集、统计分析与利用，编制分析报告，提出业务管理的改进建议；3、跟踪业务/重点项目的发展变化，对业务经营发展状态进行监控分析，提出策略建议报告；4、负责监控各业务线执行情况，推进经营分析相关事项的落地；5、其他相关工作任务。职位要求:1、985/211大学本科及以上学历， 数学、统计、经济等相关专业优先；2、具有快速学习和思考能力，优秀的商业分析能力、敏锐的数据洞察力、结构化思维能力；3、三年以上数据分析相关从业经验；4、精通excel操作（常规函数、数据透视表、模型搭建），熟练使用SAS、Python、R、SPSS等进行数据分析工作；熟练使用SQL5、责任心强，具备沟通协调和闭环管理、推进能力。职能类别：数据库工程师(DBA)大数据开发工程师关键字：数据分析数据库大数据微信分享
