company_name,max_wages,min_wages,place,place2,education,treatment,requirement
数据运营专员,15000.0,8000.0,天府二街151号领地环球金融中心A座36楼云筑网；,成都-高新区,本科,"五险一金,补充医疗保险,交通补贴,餐饮补贴,通讯补贴,绩效奖金,弹性工作,定期体检",岗位职责：1、设计数据标准、数据质量和源数据；2、建设数据仓库，搭建高质量可用的数据基础；3、数据仓库的架构与模型设计以及相应的ETL开发；4、可视化数据看板开发、迭代、管理；5、进行日常数据的清洗和维护；6、定期或不定期提供数据分析简报；7、挖掘外部数据资源，定期出具分析报告。任职资格：1、统招本科以上学历，统计学、数学、计算机相关专业优先；2、至少有3年及以上数据分析等相关工作经验；3、有较强的逻辑思维和分析能力，统计学等专业或互联网行业相关岗位经验丰富者优先考虑。职能类别：数据分析师关键字：数据分析数据运营大数据微信分享
数据工程师G00258,11000.0,6000.0,新世纪环球中心S2，1642室,成都-武侯区,本科,"五险一金,交通补贴,餐饮补贴,通讯补贴,定期体检,餐补,弹性工作,绩效奖金,节日福利,带薪年假",岗位职责1、负责项目的数据分析、收集、整理工作；2、负责各类数据标准、技术文档的编写和培训；3、负责梳理各类指标、审查规则，构建计算模型；4、负责数据产品研究、部署实施、培训和技术指导；5、负责统筹项目数据生产和质量监督，控制进度；6、负责项目中其他数据支持工作。任职条件1、两年以上工作经验。2、能够熟练运用ArcGIS、AutoCAD、Supermap、MapGIS、FME等GIS平台、Access、excel等软件进行流程化的空间数据分析、处理。3、熟悉自然资源行业的测绘、地质、土地、矿产、林业、不动产等各类数据结构和标准、业务知识及法律法规。4、有一定的文档编写能力，能够完成数据标准、数据分析报告、实施方案、数据研究报告等文档的编写。5、具有很强的逻辑思维，能够从业务中分析、挖掘出各类业务规则。6、具有良好的组织和协调能力、沟通能力、学习能力和团队合作意识、良好的职业素养、责任心及抗压能力，能够积极主动完成本职工作和学习新的知识。7、全日制本科及以上学历，GIS、测绘、城市规划、土地资源管理相关专业优先。职能类别：数据分析师微信分享
数据分析员-五险一金,6000.0,4500.0,环球中心,成都-高新区,大专,无,岗位职责1、协助制定团队年度、季度、月度计划任务，对任务数据进行核查。2、追踪销队任务完成情况并进行数据分析。3、对数据进行专项分析，编制相关的数据分析报表。4、原有数据报表的整合、规范和优化，研究改进数据分析的方法，建立自动推送报表机制。任职要求：1、大专及以上学历，经济、管理、统计相关专业，有数据分析工作经验者优先，优秀的应届生亦可考虑。2、熟练使用Excel函数及制图、。3、对工作认真负责，有优秀的逻辑思维能力、沟通能力和团队合作精神。4、积极主动，学习能力强，善于思考工作中的问题并提出建议。5、做事细心、耐心，性格沉稳。薪酬福利：1、五险一金、周末双休、上午9点下午6点，基本工资5000+绩效奖金；2、享受带薪年假，国家法定节假日，带薪国内外旅游；3、公司提供专业的带薪岗前培训；4、全天空调室内办公，每人拥有独立的工作区；5、集团公司、横向、纵向发展空间大，岗位晋升体系完整且透明职能类别：数据分析师微信分享
数据分析岗,8000.0,6000.0,神州智慧天地C座,成都-武侯区,本科,"专业培训,绩效奖金,高温补贴,节日福利,带薪年假,五险一金,补充医疗保险,年终奖金,定期体检",岗位职责：1、对所负责业务工作进行追踪与推动，完成业务指标分析及业务目标达成；2、检视业务现场问题，提出优化建议并化为行动；3、负责销售业务数据分析及领导交办的其他工作。任职要求：1、全日制本科及以上学历毕业，有学位证；2、精通EXCEL、WORD、OFFICE等办公软件；3、2年以上相关工作经验职能类别：数据分析师关键字：数据分析数据处理微信分享
数据分析员,8000.0,5000.0,武侯区锦绣路1号保利中心c座1508,成都,本科,"专业培训,周末双休,五险一金,定期团建,节日福利,绩效奖金",工作内容：1）主导开展数据分析报告输出工作，依据标准化的数据和挖掘工程师制定的分析方法，输出数据分析报告2）协助开展数据清洗、标准化工作，支持数据入库（城市、区域、年龄、事故原因、事故结果、受伤严重程度、从事岗位、行业、医疗费用等数据清洗后入库）3）协助数据挖掘工程师、开发工程师完成数据库搭建和数据分析建模工作4）对***录入的数据进行质量核验及复查修改4）参与数据分析报告优化和创新技能要求：1）熟练掌握一种常用编程语言（Python、R优先）2）有过数据分析输出经验，能良好的输出数据分析报告3）拥有大量数据处理经验者（数据清洗、分析处理）4）具有基本的工业认知和优秀的数据分析能力，能够理解和运用常见的分析方法5）数字敏感度高，具备良好的数据呈现能力，能熟练使用word有逻辑的展现数据分析6）应届-3年相关工作经验7）大学本科（计算机、统计学、数学、数据科学与大数据技术、机器学习）软素质要求：1）具有良好的沟通协调能力2）抗压能力职能类别：数据分析师关键字：数据分析师数据处理微信分享
高级软件开发工程师-大数据分析与运用,20000.0,15000.0,成都,成都,硕士,"五险一金,带薪年假,节日福利,做五休二,员工旅游,定期体检,年终奖金",1、负责数据库安装、部署及日常运维工作；2、负责完成数据采集、诊断、清洗、汇总、管理工作；3、协助客户利用数据分析工具（SAS、SPSS、R、Python）开展大数据分析挖掘，构建数据挖掘模型、产生数据分析报告等工作；4、协助了解客户业务需求，结合数据分析成果提供业务差异化和精细化管理咨询服务工作；5、参与集团产品设计、开发、测试、应用等研发工作，包括但不限于需求梳理、数据准备、技术开发、测试案例编写以及相关功能和数据准确性测试。6、参与公司技术文档以及产品文档的撰写工作岗位要求：1、硕士及以上学历，统计、数学、计算机相关专业，5年及以上平台构建经验；2、熟悉数据库原理，熟练运用SQL、Mysql/Sqlserver/Oracle/DB2等；3、熟悉定量分析基本原理，会用SAS、R、SPSS、Python等统计工具；4、有医疗信息化从业经历，并从事过数据挖掘、数据分析相关岗位工作；5、至少熟悉一门主流开发语言（Java、C#等），并掌握其主流开发框架，熟悉linux/unix系统；6、了解国内外主流报表工具，至少掌握其中一种，精通数据处理、数据建模流程；7、能学习现有产品所采用的开发语言和开发框架；职能类别：数据分析经理/主管微信分享
数据分析员,8000.0,5000.0,蓝光大厦,成都,本科,"绩效奖金,年终奖金,五险,节日福利,周末双休",岗位职责：1、负责各类项目数据清洗、分析、建模，形成数据分析报告；2、负责制式化项目方案、问卷设计，并进行全流程跟踪；3、配合专家顾问团队做好资料收集工作；4、完成上级领导交办的其他任务；任职要求：1.统计学、计量经济学、社会学等相关专业，本科及以上学历；2.有较强的文字撰写能力及逻辑思维能力；3.有较强的数据分析、处理能力，熟练使用常用统计软件（SPSS、R等）；4.具有快速学习能力、良好的语言表达和沟通能力，认真细致有责任心，抗压能力较强。职能类别：咨询员微信分享
数据分析工程师,15000.0,10000.0,吉泰路88号香年广场T3楼30层,成都-高新区,本科,"五险一金,餐饮补贴,交通补贴,带薪年假,员工旅游,绩效奖金,国内外旅游,专业培训,定期体检,项目奖金","工作职责1、负责并参与无线电监测数据分析设计与开发工作，主要包含数据采集、数据处理、数据服务等工具或API的设计与开发2、与项目组共同制定数据采集、数据处理、数据服务、数据安全的规范与协议3、研究数据分析相关前沿技术，持续优化与提升数据分析在无线电监测行业的应用职位要求1、计算机或数学相关专业本科以上学历，3年以上工作经验2、熟悉数据建模与分析治理，具备扎实的编程能力与良好的编程习惯3、熟悉主流大数据分析工具或技术，如：hadoop, spark, flink, elasticsearch, redis, kafka, hbase, mongodb等4、熟悉python编程与常用库，如：numpy, pandas, matplotlib5、熟悉关系型数据库与NoSql数据库以及Sql调优优先6、熟悉其它编程语言或工具者优先，如：javascript, node.js, c#, java等7、了解无线电监测业务者优先职能类别：数据分析师关键字：数据sqlhadoopsparkpython数据分析师微信分享"
数据分析（业务运营方向）,12000.0,8000.0,天府三街腾讯大厦,成都-高新区,本科,"免费班车,弹性工作,节日福利,免费早餐,带薪年假,五险一金,绩效奖金,专业培训,商业保险,住房补贴",岗位职责：1、通过自主挖掘与数据分析，准确定位业务矛盾，建立完善的业务运营机制流程；2、通过分析数据外部风险，联动业务上下游，通过现有AI技术、策略等资源的整合，制定有效运营方案，确保达成效果3、对所负责模块进行数据反馈跟进，并持续优化策略，驱动项目达成目标；岗位要求：1、本科以上学历，统计学或数学相关专业3年以上相关工作经验；2、有良好的统计算法基础，熟悉分类、聚类、回归、关联分析等算法原理；3、熟悉python或SQL等数据库工具，能够达到熟练使用；4、抽象及逻辑能力强，有系统思考能力，具备策略技术理解能力5、有涉及AI领域工作经验者优先。职能类别：数据运营关键字：业务运营微信分享
策略师,10000.0,8000.0,来福士广场T2,成都-武侯区,本科,"五险一金,绩效奖金,弹性工作,周末双休,年终奖金,定期团建",岗位要求：1、具有逻辑思维能力、工作中较强运用策略分析能力2、完成公司指定策略发展任务，技术技巧完美运用工作中3、开朗、自信，能够承受较大压力，思维敏捷，行动迅速；工作时间：周一至周五，上午10：00—下午17:00，午休一个半小时，周末双休。国家法定节假日正常放假。福利待遇：（一）薪资待遇1、入职后薪资结构主要为底薪加绩效，公司奉行能者多得的原则，薪资收入没有上限。2、特殊人才薪资待遇另行面议。（二）福利待遇：1、入职购买社保，提供丰厚的节日福利和补贴等，定期不定期举行团建聚餐等活动，让员工劳逸结合。2、支持各类人才进一步学习创新，考取各类证件，合适人才将会报销其相关费用，并可为大四学生提供实习证明。3、对于优秀人才，公司每年都提供海外学习交流的机会。职能类别：数据分析师关键字：策略研究分析微信分享
数据分析（BI）,10000.0,6000.0,武侯区龙腾东路36号中海大厦5楼,成都-武侯区,本科,"五险一金,带薪年假,节日福利,周末双休",岗位职责：1、负责搭建当地报表体系，对业务数据进行统一管理，建立、优化和完善运营数据指标体系；2、负责深度分析城市数据，针对关键问题进行业务诊断并形成专项分析报告；3、负责通过数据发现业务规律与潜在问题，在规律中寻找增长点，并建立预警机制，确保业务健康；4、负责对接数据产品，完善数据分析工具，提升数据输出效能。任职要求：1、本科及以上学历，统计/数学/计算机相关专业学历背景优先，优秀者可适当放宽；2、具备较强的数据敏感度和逻辑思维，能够独立搭建数据模型与数据体系，并能通过数据发现问题提供策略；3、熟悉PPT制作，精通SQL、Excel，BI背景优先考虑。福利：1、入职即购五险一金，周末双休；2、每年一次免费员工全面体检；3、不定期团建活动，CG活动，节假日福利，生日会；4、完善的培训体系，各类专业技能培训应有尽有；5、每年2次调薪机会。职能类别：数据分析师关键字：数据处理数据分析师sqlBI可视化微信分享
数据分析员/可接受实习,7500.0,5000.0,武侯区罗浮广场,成都-武侯区,大专,无,岗位职责1、协助制定销售团队年度、季度、月度计划任务，对任务数据进行核查。2、追踪销售团队任务完成情况并进行数据分析。3、对销售数据进行专项分析，编制相关的数据分析报表。任职要求：1、大专及以上学历，专业不限；2、对工作认真负责，有优秀的逻辑思维能力、沟通能力和团队合作精神；3、积极主动，学习能力强，善于思考工作中的问题并提出建议。薪酬福利：1、基本工资+各种补贴+绩效奖金，综薪5000-7500；2、入职购买五险一金，上班时间朝九晚六、周末双休；3、拥有行业内部独具竞争力的薪酬体系；4、丰富的内部培训以及外部拓展活动；5、享受员工节假日礼品和年终奖等福利；6、拥有公开、透明的晋升机制和每季度考核调薪；温馨提示：请保证您的简历的真实性，您的简历通过筛选之后我司将会通知您参加面试，谢谢！职能类别：数据运营关键字：数据分析运营微信分享
数据分析,6000.0,4500.0,蜀汉路89号2楼蓉雅晶肤,成都-金牛区,大专,"五险一金,出国机会,定期体检,年终奖金,员工旅游",1、大专及以上学历;2、对Office工具熟练，EXCEL能熟练运用，熟练使用Sql Server等数据库工具、熟练使用SQL/Python等统计分析工具的优先考虑;3、对数据敏感，有较好的逻辑思维能力;4、工作严谨、责任心强，能承受工作压力5、性格开朗活泼。本工作不带任何销售性质。福利待遇1、入职购买五险一金2、法定节假日+年假+社保+公积金+午饭+月休6天，+节日礼金/品+生日福利/购物卡+特殊慰问+健康体检3、有良好的学习和晋升空间4、应届毕业生优先职能类别：数据分析师微信分享
数据分析高级专员,6000.0,4000.0,安博成都龙泉物流中心,成都-龙泉驿区,本科,"周末双休,带薪年假,五险一金,节日福利,专业培训,餐饮补贴,绩效奖金",工作内容1、负责仓储运作数据统计分析：对接仓库相关作业部门，完成各类作业数据的统计，及时准确的提交各类作业数据分析报表，同时定期评估修订统计报表，  为管理层提供决策依据。2、负责仓储作业效率登记及分析：对接仓库相关作业部门，完成作业时间与作业产量的统计，及时完成各部门的作业效率分析、发布、异常反馈，组织相关会议，并完成月度分析报告，为仓库人员排班、KPI目标设定、作业能力提升提供参考依据。3、绩效考核计算汇总：对接仓库相关作业部门，确保绩效考核数据准确，定期计算并分析周、月KPI，核实数据异常原因，并发布，月初汇总并计算各部门指标得分。4、物流账单及服务KPI整理与发布：按时完成计算并分析物流账单及各品牌KPI达成情况，对接品牌运营部及财务部完成账单和KPI后续核对工作。5、集团物流指标定义标准化：对公司现有指标的定义，计算方法及取值等标准化、规范化，确保各指标计算有据可依，有理可循。任职要求1.从事统计或数据分析工作1年以上经验，物流管理、数学、统计类、计算机相关专业 ；3.对数字具有一定的敏感度，具备数据分析能力;4.掌握统计知识和与财务有关业务知识、熟练使用OFFICE等办公软件;职能类别：数据分析师关键字：数据分析效率分析微信分享
数据分析岗,6000.0,4500.0,武侯区大悦路518号成都大悦城6F,成都-武侯区,本科,"带薪年假,餐饮补贴,年终奖金,加班补贴,专业培训,做五休二,五险一金,绩效奖金",岗位职责：1、制作数据报表，包含经营日报、周报、月报分析汇总，跟踪反馈各类经营情况；2、针对经营数据进行深入分析，透过数据反映目前公司经营中的问题，并研究问题解决方案，为公司发展提供决策支持；3、通过消费者行为数据分析，深入分析消费者场内消费行为，挖掘消费者需求，助力场内经营调整及品牌调改；4、与第三方大数据分析公司沟通协作，利用第三方公司数据资源，研究客户画像，研究到场消费者的定制化消费模式；5、通过多渠道市场商情搜集，汇总零售商业市场动态及新兴业态趋势，并定期对商业市场趋势动态进行深度分析；6、 经营层面数据模型创新研究：深入学习、研究数据分析、数据挖掘理论方法，将多种数据分析、数据挖掘模型应用到工作层面，不断创新分析方法，挖掘更有意义的信息价值；任职资格：1、熟练使用excel、PPT；2、熟悉SPSS分析工具，从数据清洗、数据统计、模型分析（相关、聚类等）熟练使用；3、具有数据敏感性，善于发现数据背后的问题；4、具有创新意识，能尝试从不同角度，使用不同工具，不同的模型方法分析数据和市场问题；5、具有严谨的逻辑思维能力，跨部门沟通能力，乐于钻研，善于学习前沿的新工具和方法。职能类别：市场分析/调研人员关键字：调研数据分析研策微信分享
大数据分析培训师,20000.0,10000.0,徐汇区沪闵路8075号虹梅商务大厦749室,上海-徐汇区,本科,"周末双休,带薪年假,五险一金,节日福利,餐饮补贴,专业培训,通讯补贴,员工旅游,免费体检,定期体检","1、负责算子手册、知识点、实验手册的编写；2、负责大数据课程体系的设计、编制工作；3、负责双实平台客户的使用者的系统性培训。任职要求：1、本科以上学历，应用数学、统计学或计算机及相关专业；2、熟悉Python,scala至少一种,精通MapReduce模型；3、有数据分析、挖掘、清洗、建模相关工作经验；4、熟练使用各种数据挖掘算法，对算法、数据结构有深入理解；5、良好的沟通表达能力及文字编写能力；6、有大数据领域售前咨询类或从事过大数据分析培训工作经验者优先。职能类别：数据建模工程师关键字：MapReduce微信分享"
数据工程师,10000.0,8000.0,双流西航港大道中四段281号,成都,本科,"五险一金,交通补贴,通讯补贴,绩效奖金,定期体检,员工旅游",1. 熟练掌握SQL语句的编写，熟练使用SQL进行各种简单或复杂的查询，能够编写、调试存储过程；2. 熟悉Oracle、mysql、SQLServer等数据库(至少一种)；3. 良好的沟通表达和团队合作能力，有责任心、有一定的需求分析能力、文档撰写能力。职能类别：数据分析师微信分享
高级分析专员,20000.0,10000.0,成都爱奇艺创新大厦-成都市高新区新川南五路188号,成都-高新区,无,"五险一金,周末双休,13薪",工作职责:1、实时关注全球手游及互联网产业变化和竞争对手动态，对行业竞争对手进行洞悉研究，帮助公司及时捕捉优秀的战略发展目标和机会；2、研究国内外手游市场，分析产品和市场发展趋势，定期输出相关信息或报告；3、对重点品类，竞品进行研究，分析产品设计思路和玩法趋势变化，为公司产品布局新品立项提供支持和参考；4、为引入产品提供测评意见，分析产品优劣，提供新项目引进参考意见；任职资格:1、3年以上游戏行业相关工作经验优先；2、对游戏行业有浓厚的兴趣，熟悉国内外游戏行业发展趋势；3、能洞察行业生态发展新方向，发现潜在合作伙伴及其与公司的战略协同点；4、熟练使用游戏行业热门数据分析相关工具；温馨提醒：如果7天内您没有收到爱奇艺的面试邀请，那么目前我们不会安排您参加后续的面试环节，感谢您的理解和对爱奇艺的关注与认可。职能类别：数据分析师关键字：游戏市场分析微信分享
双流诚聘数据分析主管,8000.0,6000.0,宗申塞纳维54栋，大唐房屋总部,成都-双流区,本科,"弹性工作,带薪年假,专业培训,绩效奖金,节日福利",岗位职责：1. 监测统计市场数据，根据市场数据及公司内部数据，搭建数据报表，撰写分析报告；2. 自主进行业务数据挖掘与分析，以数据分析结果为管理层提供决策依据；任职资格：1. 对数据敏感并有很强的洞察能力、分析能力；2. 业务学习能力，能够把数据和业务紧密联系，并对市场做出判断；3. 全日制本科及以上学历，统计/数学/计算机相关专业学历背景优先，优秀者可适当放宽；4. 一年以上房产行业数据运营或数据分析经验，精通EXCEL，熟练使用SQL、Python、BI等工具优先考虑。职能类别：数据分析师数据分析经理/主管微信分享
数据分析主管,6000.0,4500.0,金仙桥路18号1栋3楼1323#-1329#,成都-金牛区,大专,"做五休二,带薪年假,五险一金,节日福利,绩效奖金,交通补贴,通讯补贴",a负责数据监控、整理、分析和管理工作b负责对销售数据进行分析，开发完善各项销售数据的分析模型c对产品数据的表单进行维护，包括表单的整理统计和分析，制作数据报表和进度表d跟踪了解项目数据及数据变化趋势，并能及时做出判断和分析e针对具体的业务问题，规划设计基于数据挖掘出具相关的数据报告，为公司的销售策略，销售方向提供数据支持f对数据有较高敏感度，能根据数据的本身发现问题，并进行项目发展趋势的分析和信息反馈g管理和改进项目的数据统计分析模型，建立数据流转规则和异常现象的预警机制6岗位要求：a有数据分析工作经验，具有较强的数据统计和分析处理能力bExcel运用能力极强，熟练使用可视化软件如：Python、Tableauc本科以上学历，熟练使用办公软件EXCEL、PowerPointd熟练使用可视化软件如e英文读、写熟练f学习能力强，具有良好的沟通能力与应变能力，时间观念强，有团队精神g踏实、个性开朗、头脑灵活、反应敏捷，责任心较强职能类别：数据分析师微信分享
高级数据管理员(J15023),15000.0,10000.0,天府生命科技园科园南路69号金蓉大厦,成都-高新区,本科,"五险一金,通讯补贴,年终奖金,定期体检,项目奖金,专业培训,弹性工作,试用期全薪",工作职责:1、根据方案，设计、审阅eCRF初稿；作为数据管理内部对外沟通的桥梁，起核心作用；2、撰写、审核、更新、维护、存档数据管理全流程相关文档：DMP/DVP/CCG/DMR/外部数据传输协议等；必要时组织相关审核会议；3、执行和审阅数据库测试、上线、锁定、盲态审核会议汇报等数据管理里程碑事件；4、执行和审核数据清理、质疑管理、医学编码、外部数据一致性核查、SAE一致性核查；5、确保严格按照SOP执行每一项数据管理活动；6、领导数据管理专员独立完成项目；7、负责对数据管理员的指导、培训和监督工作。任职资格:1、本科及以上，药学及计算机专业***。3~4年相关工作经验，优秀者可适当放宽专业限制。2、精通临床试验数据管理全部流程，精通CRF设计，EDC测试及上线，数据核查计划撰写，外部数据管理，严重不良事件一致性核查等。3、既往至少有10个以上BE项目完整经验，领导过与过II/III期项目的数据管理，有数据管理项目管理的经验；4、熟悉GCP，精通数据管理相关法规，并有自己的见解；5、熟悉CDISC数据标准；6、独立领导数据管理项目；7、使用过主流EDC系统：RAVE、Inform、太美、OCRDC等；8、沟通能力强，具有跨职能部门沟通交流能力，工作态度负责。职能类别：数据分析师微信分享
